{
  "generated_at": "2026-07-21T20:22:14Z",
  "platforms": {
    "google": {
      "observation_count": 3,
      "products": [
        "augment-code"
      ]
    }
  },
  "products": {
    "augment-code": {
      "observation_count": 3,
      "platforms": [
        "google"
      ]
    }
  },
  "schema_version": "0.1"
}
